{"canonicalization_version":"part1-canonical-json-v1","logical_filename":"questions.jsonl","manifest_format_version":"jsonl-v1","ordered_record_aggregation":"canonical-record-bytes-in-manifest-order-v1","question_manifest_hash":"dd379f48322d6eb07c309101361738a965be320b4124bb45bd44723b1abe474d","question_sampling_seed":42,"quota_per_subject":100,"schema_name":"part1_question_manifest","schema_version":"1.1.0","selection_algorithm_version":"part1-per-subject-full-buffer-shuffle-v1","source_config_strategy":"per_subject","source_configs":["high_school_mathematics","high_school_physics","high_school_chemistry","high_school_biology","high_school_psychology"],"source_repository":"cais/mmlu","source_revision":"c30699e8356da336a370243923dbaf21066bb9fe","source_split":"test","subjects":["high_school_mathematics","high_school_physics","high_school_chemistry","high_school_biology","high_school_psychology"],"total_count":500}
